{
  "id": "person-0015",
  "entity_type": "person",
  "label_original": "龔子敬",
  "label_normalized": "龔子敬",
  "first_seen_entry_id": "entry-0022",
  "aliases": [
    {
      "surface": "龔子敬+山長",
      "alias_type": "office",
      "ambiguous": false,
      "notes": null
    },
    {
      "surface": "子敬",
      "alias_type": "alias",
      "ambiguous": false,
      "notes": "8월28일 學道書院 山長 (cf. entry-0022)"
    }
  ],
  "notes": null,
  "status": "active",
  "relations": [],
  "appointments": [
    {
      "office_id": "office-0003",
      "institution_id": null,
      "place_id": "place-0013",
      "period_raw": "entry-0022",
      "period_start": null,
      "period_end": null,
      "source_entry_ids": [
        "entry-0022"
      ],
      "source_external": null,
      "grade": "confirmed",
      "notes": null
    }
  ],
  "residences": [],
  "external_ids": {
    "cbdb": {
      "id": null,
      "grade": "unresolved",
      "notes": "pilot placeholder"
    }
  }
}
