{
  "id": "person-0060",
  "entity_type": "person",
  "label_original": "зЛДдїБеНњ",
  "label_normalized": "зЛДдїБеНњ",
  "first_seen_entry_id": "entry-0027",
  "aliases": [
    {
      "surface": "дЄєеЊТ+еЃ£еЈЃ+зЛДдїБеНњ",
      "alias_type": "office",
      "ambiguous": false,
      "notes": "дЄєеЊТ"
    }
  ],
  "notes": "дЄєеЊТ",
  "status": "active",
  "relations": [],
  "appointments": [
    {
      "office_id": "office-0013",
      "institution_id": "institution-0009",
      "place_id": "place-0050",
      "period_raw": "entry-0027",
      "period_start": null,
      "period_end": null,
      "source_entry_ids": [
        "entry-0027"
      ],
      "source_external": null,
      "grade": "confirmed",
      "notes": "дЄєеЊТ"
    }
  ],
  "residences": [],
  "external_ids": {
    "cbdb": {
      "id": null,
      "grade": "unresolved",
      "notes": "pilot placeholder"
    }
  }
}
