{
  "id": "institution-0003",
  "entity_type": "institution",
  "label_original": "北關門接待寺",
  "label_normalized": "北關門接待寺",
  "first_seen_entry_id": "entry-0025",
  "aliases": [],
  "notes": null,
  "status": "active",
  "institution_info": {
    "institution_type": "temple",
    "place_id": "place-0017",
    "parent_institution_id": null
  },
  "external_ids": {
    "inindex": {
      "url": null,
      "grade": "unresolved",
      "notes": "pilot placeholder"
    }
  }
}
