{
  "id": "person-0023",
  "entity_type": "person",
  "label_original": "李伯玉",
  "label_normalized": "李伯玉",
  "first_seen_entry_id": "entry-0025",
  "aliases": [],
  "notes": null,
  "status": "active",
  "relations": [],
  "appointments": [],
  "residences": [],
  "external_ids": {
    "cbdb": {
      "id": null,
      "grade": "unresolved",
      "notes": "pilot placeholder"
    }
  }
}
