{
  "id": "place-0002",
  "entity_type": "place",
  "label_original": "錢塘",
  "label_normalized": "錢塘",
  "first_seen_entry_id": "entry-0019",
  "aliases": [],
  "notes": "전당",
  "status": "active",
  "place_info": {
    "place_type": "city",
    "admin_level": "xian",
    "parent_place_id": null,
    "coordinates": {
      "lat": 30.29412,
      "lng": 120.16862,
      "precision": "exact"
    },
    "period_names": [
      {
        "name": "錢塘縣",
        "period": "元"
      }
    ]
  },
  "external_ids": {
    "chgis": {
      "id": "hvd_40079",
      "uri": "https://chgis.hudci.org/tgaz/placename/hvd_40079",
      "grade": "confirmed",
      "notes": "Official CHGIS 1308 query returns Qiantang County."
    }
  }
}
