{
  "id": "place-0006",
  "entity_type": "place",
  "label_original": "太平寺",
  "label_normalized": "太平寺",
  "first_seen_entry_id": "entry-0020",
  "aliases": [],
  "notes": "常州성 내의 사찰",
  "status": "active",
  "place_info": {
    "place_type": "temple",
    "admin_level": null,
    "parent_place_id": null,
    "coordinates": null,
    "period_names": []
  },
  "external_ids": {
    "chgis": {
      "id": null,
      "grade": "unresolved",
      "notes": "pilot placeholder"
    }
  }
}
