{
  "id": "place-0039",
  "entity_type": "place",
  "label_original": "湖州市妙行寺",
  "label_normalized": "湖州市妙行寺",
  "first_seen_entry_id": "entry-0026",
  "aliases": [],
  "notes": null,
  "status": "active",
  "place_info": {
    "place_type": "temple",
    "admin_level": null,
    "parent_place_id": "place-0016",
    "coordinates": null,
    "period_names": []
  },
  "external_ids": {
    "chgis": {
      "id": null,
      "grade": "unresolved",
      "notes": "pilot placeholder"
    }
  }
}
