{
  "id": "place-0019",
  "entity_type": "place",
  "label_original": "沈待詔之樓",
  "label_normalized": "沈待詔之樓",
  "first_seen_entry_id": "entry-0025",
  "aliases": [],
  "notes": null,
  "status": "active",
  "place_info": {
    "place_type": "other",
    "admin_level": null,
    "parent_place_id": null,
    "coordinates": null,
    "period_names": []
  },
  "external_ids": {
    "chgis": {
      "id": null,
      "grade": "unresolved",
      "notes": "pilot placeholder"
    }
  }
}
